{
  "owners": [
    {"owner":"vercel-labs","totalInstalls":5100000,"featuredRepo":"vercel-labs/skills","featuredSkill":"find-skills","skills":[
      {"id":"vercel-labs/skills/find-skills","source":"vercel-labs/skills","slug":"find-skills","name":"find-skills","installs":4082959,"sourceType":"github","installUrl":"https://github.com/vercel-labs/skills","url":"https://skills.sh/vercel-labs/skills/find-skills","official":true,"duplicate":false},
      {"id":"vercel-labs/agent-skills/react-best-practices","source":"vercel-labs/agent-skills","slug":"react-best-practices","name":"react-best-practices","installs":1017041,"sourceType":"github","installUrl":"https://github.com/vercel-labs/agent-skills","url":"https://skills.sh/vercel-labs/agent-skills/react-best-practices","official":true,"duplicate":false}
    ]}
  ],
  "totalOwners": 1,
  "totalSkills": 2,
  "generatedAt": "2026-10-28T00:00:00Z"
}
